{
  "contract_name": "DataEnvelope",
  "contract_version": "1.0.0",
  "object_id": "synthetic-DataEnvelope",
  "object_version": 1,
  "trace_id": "synthetic-trace",
  "content_hash": "sha256:db069a2c782a7abfdf31d3916c235961bac96038f1d1f74ff743f42ee8ef858e",
  "recorded_at": "2026-10-05T02:00:00Z",
  "business_timezone": "Asia/Shanghai",
  "provenance": {
    "event_time": "2026-10-05T02:00:00Z",
    "published_at": null,
    "available_at": "2026-10-05T02:00:00Z",
    "retrieved_at": "2026-10-05T02:00:00Z",
    "publication_precision": "NOT_APPLICABLE",
    "source_id": "synthetic",
    "source_version": "fixture-v1",
    "source_hash": "sha256:84ad53f246eb870dba610ababc5deab5819f4c2a32f25b3c6bccbb711852fa5a",
    "visibility_basis": "SYNTHETIC"
  },
  "reason_codes": [
    "SYNTHETIC_FIXTURE_ONLY"
  ],
  "invalidation": {
    "status": "ACTIVE",
    "valid_until": "2026-10-05T03:00:00Z",
    "invalidated_at": null,
    "conditions": [
      "upstream version/hash changes invalidate"
    ],
    "reason_code": null
  },
  "entity_id": "synthetic-entity",
  "data_kind": "ANNOUNCEMENT",
  "symbols": [
    "SSE:600000"
  ],
  "raw_uri": "fixture:synthetic",
  "raw_hash": "sha256:84ad53f246eb870dba610ababc5deab5819f4c2a32f25b3c6bccbb711852fa5a",
  "payload": {
    "title": "visible synthetic evidence",
    "price": "10"
  },
  "payload_hash": "sha256:fddf63bd73b1093ebfc7eb01069a7a7bb28e18f84b139042a325bd981cf05787",
  "data_quality": "PASS",
  "adjustment": "NOT_APPLICABLE",
  "adjustment_version": "NOT_APPLICABLE",
  "source_revision": "fixture-v1"
}
